{"data":{},"event_id":"evt_00000000000000000000000000000000","event_type":"observation.recorded","occurred_at":"2026-01-01T00:00:00Z","privacy_class":"restricted","provenance":["ing_00000000000000000000"],"published_at":"2026-01-01T00:00:01Z","schema_version":"1","sequence":1,"subject_id":"sub_00000000"}
